asin,title,price,rating,sales_volume,reviews_count,description,image_link
B001FA22DC,PRESSMAN TOYS PRE442606 MANCALA-AGES 6 TO ADULT; 2-4 PLAYERS,16.99,4.6,3K+ bought in past month,24388,"Product Description Mancala is one of the world's oldest and best-loved games, and Pressman's folding wooden Mancala board offers an affordable way to play that makes a great travel game as well as a wonderful home edition. Players take turns scooping up the special stones and counting them out one at a time into the pockets on the board. When they drop a stone into an empty pocket on their side of the board, they capture all the stones in the opposite pocket. It sounds like a simple marble game, but it's got plenty of strategy and reinforces STEM skills like counting and strategic planning. The winner is the player who collects the most stones! This folding Mancala includes a hinged wooden playing board, 48 plastic stones, and complete instructions. From the Manufacturer Mancala is thousands of years old, tracing its lineage to ancient Egypt. Legend has it that workers played the game during rest periods while building the pyramids. But the game is great for modern times as well--it has gained new popularity as one of the world's most intriguing and clever two-player games. To start, place all the stones in the pockets of the board. When it's your turn, choose a pocket and scoop up all the stones in it, then drop them back into the pockets one-by-one as you circle the board. With just a few easy rules to follow, the object is to collect the most by the end of the game. All the pieces go back inside the game unit for easy storage. This set includes: 1 high quality wood hinged playing board, 48 plastic stones and complete instructions.",https://m.media-amazon.com/images/I/81UJIhKs7AL._AC_SL1500_.jpg
B008J87PVC,"Hasbro Twister Party Classic Board Game for 2 or More Players,Indoor and Outdoor Game for Kids 6 and Up,Packaging May Vary",14.97,4.7,6K+ bought in past month,13265,"Product Description It’s the Twister game, the classic game that ties players up in knots! This action-packed group game is fun for parties or a game night with the family. See where the spinner lands and make a move. Left hand red, piece of cake! Right hand yellow, no problemo! Hilarity ensues as players twist, turn, tangle -- and struggle to keep their hands and feet glued to the mat. Right foot blue … uh oh, this is getting tough! Who can do it? Once a player topples over, or their knee or elbow hits the mat, they're out. The last player standing wins! For ages 6 and up, the Classic Twister game is a fun thing to do while staying at home, and it’s a great outdoor game for kids to play with family and friends. Are you ready to be the next Twister game champ? Hasbro Gaming and all related trademarks and logos are trademarks of Hasbro, Inc. Amazon.com Over forty years old and going strong! Soon after its release in 1966, Twister was made instantly popular when Johnny Carson and Eva Gabor played it on The Tonight Show . Such a simple concept, with so much potential for hilarity. The game includes a plastic mat with red, blue, yellow, and green spots; a spinner; and instructions. To play (as if you didnt already know), two to four players face each other, with the plastic mat in the center. A referee spins the spinner, then calls out the body part and the color the arrow points to (""Left foot, blue,"" ""Right hand, yellow""). All players, at the same time, follow the directions, placing the appropriate body part on a vacant circle. Players become increasingly entangled, until someone (or everyone) finally topples, and is eliminated. The last person standinger, crouchingwins. If this doesnt bring families and friends (and celebrities) closer together, we dont know what does! Out-and-out fun. --Emilie Coulter P.when('A').execute(function(A) { A.on('a:expander:toggle_description:toggle:collapse', function(data) { window.scroll(0, data.expander.$expander[0].offsetTop-100); }); }); From the Manufacturer Add a twist of fun into any party or family night with the game that ties you up in knots. This twister game is the classic game with 2 more moves. Give the spinner a whirl and see what's next as you try to keep your hands and feet on the mat. Right foot red. Can you do it? Left foot green, you got it. If your knee or elbow touches the mat or you fall over, you are out. Be the last player standing to win. Review For 2 to 4 players Includes spinner and floor mat Skills: balance, coordination, color recognition Supply is limited -- See more",https://m.media-amazon.com/images/I/714LbaV4HQL._AC_SL1500_.jpg
B00000DMF6,Hasbro Gaming Chutes and Ladders Board Game | 2 to 4 Players | Back to School Gifts for Kids | Preschool Classroom Games | Ages 3+ (Amazon Exclusive),12.99,4.8,4K+ bought in past month,11521,"Product Description It's the exciting up-and-down-again game for little people! Land on ladders, race ahead, but watch out that you don't chute back! Loads of family fun and no reading required so every child can play. Amazon.com Be the first to move your child-shaped playing piece from square one to square 100 on the Chutes and Ladders game board--but watch out! If you land on the square that shows you ate too much candy--Ouch!--you get a tummy ache and slide down a chute to a square a few numbers below. But if you end your turn on a good-deed square, such as helping sweep up a mess, you'll be rewarded by a ladder-climb up the board. A fantastic follow-up to Candy Land , Chutes and Ladders is ideal for younger children who are still learning to take turns and just beginning to recognize numbers (the spinner stays in the single digits). It's also a gentle introduction to the higher numbers as players climb to 100 at the top of the board. And, thanks to all those chutes and ladders, it's got enough excitement to keep your 7-year-old on the edge of her seat. English and Spanish instructions are included; no reading is necessary to play. Chutes and Ladders is for two to four players. --Julie Ubben P.when('A').execute(function(A) { A.on('a:expander:toggle_description:toggle:collapse', function(data) { window.scroll(0, data.expander.$expander[0].offsetTop-100); }); }); From the Manufacturer It's the exciting up-and-down-again game for little people! Land on ladders, race ahead, but watch out that you don't chute back! Loads of family fun and no reading required so every child can play! Review For 2 to 4 players Includes game board, cardboard playing pieces, and spinner No reading required to play Instructions in English and Spanish Skills: counting Supply is limited -- See more",https://m.media-amazon.com/images/I/71Xohu2PyXL._AC_SL1500_.jpg
B01MS6B7BV,Hasbro® Don’t Break The Ice Game,10.99,4.8,8K+ bought in past month,17022,"In the Don’t Break the Ice game, players need to help Phillip the Penguin chop some ice blocks so he can make a new igloo. Brrrrr, that water’s cold, even for him! This game for preschoolers and kids ages 3 and up is filled with suspense as players take turns tapping out the blocks of ice. But watch out! If a player breaks the ice and Phillip falls through, they’re out! Reset the blocks to start a new round with the remaining players. The last player left who hasn’t made Phillip fall through the ice is the winner. Bring out this fun preschool game when looking for games for family game night, games for groups, and games for families and kids. Hasbro Gaming and all related trademarks and logos are trademarks of Hasbro, Inc.",https://m.media-amazon.com/images/I/81KhN-wJEWL._AC_SL1500_.jpg
B0C3DNT9W3,"Hungry Hungry Hippos Game for Preschoolers | Instant Marble Relaunch, Easy Set-Up & Storage| Ages 4 and Up | 2 to 4 Players | Kids Games",12.99,4.7,9K+ bought in past month,870,"Product Description It's the Operation electronic board game, a game night favorite, featuring hilarious ailments. The patient, Cavity Sam, is a little under the weather. Who can avoid the buzz and help him recover without lighting up his red nose? Players choose a Doctor card with 12 possible wacky anatomy parts to remove. Just steer clear of the sides of the game unit to avoid the dreaded buzzer! If they don't set off the buzzer, they earn the amount of money shown on the back of the card. The player with the best skills and the most money at the end of the game wins. A beloved children's game for ages 6 and up, it's one of the best family games for game night and a laugh-out-loud indoor game for playdates. Looking for fun gifts for kids? Classic board games for families make great gifts for girls and boys any time of the year! Operation and Hasbro Gaming and all related terms are trademarks of Hasbro. Amazon.com Surely countless medical careers have been launched because of this humorous game. The Operation game board features Sam the patient, lying atop a red plastic ""operating table"" with 12 body cavities exposed. Players perform highly skilled procedures with a pair of tweezers such as removing a broken heart or butterflies in the stomach. This kind of surgery requires a steady hand! Doctors must remove the offending body part without touching the metal lining of the cavity. Touch the metal edge, and you'll set off the buzzer and make Sam's nose light up. Then the designated Specialist steps in--for double the fee! If you're playing solo, try performing all 12 operations without getting zapped. Two AA batteries are required. Operation is for one or more players. --Elizabeth Ward P.when('A').execute(function(A) { A.on('a:expander:toggle_description:toggle:collapse', function(data) { window.scroll(0, data.expander.$expander[0].offsetTop-100); }); }); From the Manufacturer Doctor, the patient is here to see you! And he's got a quite a few complaints, including a broken heart, water on the knee and butterflies in the stomach! Use all your skill and coordination to remove the patient's ""ailments"" with the tweezers - without setting off the buzzer and making the patient's nose light up! When that happens, it's time to call in a specialist! Review For 1 or more players Includes game board with patient, body part tweezers, light bulb, and buzzer Instructions in English and Spanish Skills: fine motor coordination, strategy 2 D batteries required Supply is limited -- See more",https://m.media-amazon.com/images/I/81T5qNcaVlL._AC_SL1500_.jpg
B00000DMFM,"Operation Electronic Board Game, Family Games for Kids Ages 6+, Kids Board Games for 1+ Players, Funny Games for Kids, Kids Gifts (Amazon Exclusive)",19.99,4.7,4K+ bought in past month,14729,"What hue do you think of when we say apple? Hues and Cues is the award-winning vibrant game of colorful communication where players are challenged to make connections to colors with words. Using only one and two-word cues, players try to get others to guess a specific hue from the 480 colors on the game board. The closer the guesses are to the target, the more points you earn. Since everyone imagines colors differently, connecting colors and clues has never been this much fun!",https://m.media-amazon.com/images/I/711ToRjPlOL._AC_SL1500_.jpg
B084D2XQ9F,"HUES and CUES - Vibrant Color Guessing Board Game for 3-10 Players Ages 8+, Connect Clues and Guess from 480 Color Squares",19.99,4.7,7K+ bought in past month,7638,"Jump into the jungle and join the feeding frenzy! In the Hungry Hungry Hippos kids board game, players try to make their hippo chomp the most marbles to win. First, everyone releases their marbles into the center—and the chomping begins! The faster a player presses their hippo's tail, the faster it will gobble the marbles. When the chomping madness is over, each player counts their marbles. (The golden marble is worth two!) Ready for a new game? The marbles instantly reload for nonstop action! And when it’s time to put the game away, store them in their convenient storage case. Then push up the back levers of each hippo, and the game fits neatly in its box. This fun and easy to learn preschool game for ages 4 and up is one of the best family games for game night, and it’s a laugh-out-loud indoor game for kids playdates. Looking for fun gifts for kids? Preschool board games for families make great gifts for girls and boys any time of the year! Hungry Hungry Hippos and Hasbro and all related properties are trademarks of Hasbro.",https://m.media-amazon.com/images/I/71qqvlXJvPL._AC_SL1500_.jpg
B0BFP4VZCP,"3.0 Board Game, Family Board Games for Children & Adults, Block Puzzle Games for Ages 4+",49.99,4.6,3K+ bought in past month,5105,"We make family games. Designed by our family for your family. Our expanding collection of games includes the highly popular Uzzle board game, guaranteeing endless entertainment and challenges for the whole family. Explore our products and discover our collection of family games designed with love right here in the USA!",https://m.media-amazon.com/images/I/71SaknlttBL._AC_SL1500_.jpg
B07JQ5W878,"Regal Games Card Games for Kids - Go Fish, Crazy 8's, Old Maid, Slap Jack, Garbage Monster, War - Simple & Fun Classic Family Table Games - Games May Vary (6 Set)",12.99,4.8,10K+ bought in past month,14092,"Dating back to the 1940s, Regal Games has remained passionate about providing quality toys and games to kids of all ages. With an unwavering dedication to superior design and most importantly fun, we understand the importance of creating memorable experiences for the whole family.
Kids Classic Card Games
Crazy 8's
Garbage Monsters
Slap Jack
Old Maid
War
Go Fish",https://m.media-amazon.com/images/I/91yBiXWLpYL._AC_SL1500_.jpg
B07T446163,CMYK Wavelength: The Party Game Show in a Box,31.49,4.8,4K+ bought in past month,3820,"Ditch the screens and grab some cards.
Magenta is making game nights a thing again.
Fives is a modern twist on classic games like Hearts and Spades. Instead of playing a card face up, you can play it face down as a 5!
Duos is a team game where you’ll work together to create unique hands of cards. You might need a flush one round and all odds the next!
Figment is a mindbending game of visual perception. Your goal is to line them up so each card has more of a color than the card before.
Fruit Fight is a game about pushing your luck and stealing precious fruit. But be careful: if you draw one you already have, you bust!
They're trying to get you to guess where a target is secretly located under that blue screen.
So on the far left would be the hottest thing imaginable. And on the far right, the coldest.
The closer to the center of the target, the more points your team scores!",https://m.media-amazon.com/images/I/91jxT2HWS-L._AC_SL1500_.jpg
B00GPK8ISK,"Pressman Checkers -- Classic Game With Folding Board and Interlocking Checkers, 2 Players",11.99,4.3,2K+ bought in past month,22870,"Checkers is a strategy board game for two players which involves diagonal moves of uniform game pieces and mandatory captures. Not only that, it is a necessary keystone to any game closet, and this is the perfect set! This classic game set includes the game board, solid interlocking plastic checkers, and complete instructions. For 2 players, ages 6 and up.",https://m.media-amazon.com/images/I/81Xh0I6HCvL._AC_SL1500_.jpg
B08C1QBGQJ,"Regal Games - Reversible Wooden Board for Chess, Checkers & Tic-Tac-Toe - 24 Interlocking Wooden Checkers and 32 Standard Chess Pieces - for Age 8 to Adult for Family Fun",19.99,4.5,2K+ bought in past month,3627,"Checkers, Chess and Tic Tac Toe are all games that have been around for many, many years. It’s the perfect fit for family game nights, traveling, sleepovers, gatherings, parties and anytime you want a game that’s both engaging and fun.
This reversible wooden board game set comes in a box for easy transportation and storage, no matter if you're playing at home or if you're taking it on the go to play with family and friends.",https://m.media-amazon.com/images/I/81r+Y1Q3alL._AC_SL1500_.jpg
B06XY881H4,Hasbro Gaming Connect 4 Strategy Board Game for Ages 6 and Up (Amazon Exclusive),11.19,4.8,3K+ bought in past month,18729,This is the social card game that is going to change your game night forever This addictive game is as unique as its name It's a power packed quick and simple party game Race against each other to SLAP a match between a card and spoken word But - watch out! - your mind will play tricks on you This game was engineered for maximum fun Enjoy!,https://m.media-amazon.com/images/I/81Cx0btUF4L._AC_SL1500_.jpg
B0DYK1ZH2D,"CATAN Board Game (6th Edition) Trade, Build & Settle in The Classic Strategy Game for Family, Kids & Adults, Ages 10+, 3-4 Players, 60-90 Min Playtime",56.81,4.8,3K+ bought in past month,38158,"This edition of the connect 4 game offers an alternative way to play the popular strategy game. It includes 4 blue Blocker discs that players can use to block an opponent space or to lift a player checkers to quickly get 4-in-a-row to win. Players can choose to start in the middle or at the edge; to stack discs upwards, horizontally, or diagonally then drop in a blue disc for an unexpected strategy move. Stay one step ahead of opponents and block their attempts to get to 4-in-a-row first! Hasbro gaming and all related terms are trademarks of Hasbro.",https://m.media-amazon.com/images/I/71AbDpYEkgL._AC_SL1500_.jpg
B077Z1R28P,Taco Cat Goat Cheese Pizza,9.66,4.8,10K+ bought in past month,52309,"Think fast, be original and stay sharp! In the Scattergories game, roll the 20-sided letter die, flip the sand timer, and think of unique answers for each category on the list. Players race against the timer as they write down answers to categories -- such as things in your car, reality TV shows, famous animals, and things you shouldn’t touch -- each beginning with the letter “S,” for example. In this fun family board game for 2 players or more, score points for jotting down things no one else did. The more out-of-the-box the answers, the less likely someone will have it, and the more points you rack up. Online tools also enhance gameplay, giving players the option to use a web-based timer and letter die. This party game for adults and teens ages 13 and up features 190+ categories and 20 letters on the die, making it an entertaining group game for up to 6 people to play again and again. SCATTERGORIES and HASBRO and all related trademarks and logos are trademarks of Hasbro, Inc.",https://m.media-amazon.com/images/I/61B7mux9lIL._AC_SL1500_.jpg
B0BFG4JVC5,"Hasbro Gaming Scattergories Classic Game, Party Game for Adults and Teens Ages 13 and up, Board Game for 2+ Players",16.19,4.8,3K+ bought in past month,1236,A card game where you make very unpleasant comics.,https://m.media-amazon.com/images/I/81PFXGsVe1L._AC_SL1500_.jpg
B0D2JG7873,"Exploding Kittens Horrible Therapist: Extra Horrible Edition 3-8 Players - Ages 17+ - 15 Minutes to Play - Comic Building Card Game - Ideal for Party, Family Game Night - White",19.99,4.6,6K+ bought in past month,972,"['https://m.media-amazon.com/images/S/aplus-media-library-service-media/446cefa0-4f81-4905-ae7d-334a99a197ba.__CR0,0,600,180_PT0_SX600_V1___.jpg']",https://m.media-amazon.com/images/I/71Sjn4oQ3oL._AC_SL1500_.jpg
B0D8LZ6W9L,Slay The Spire: The Board Game - Cooperative Fantasy Board Game,114.99,4.6,600+ bought in past month,61,"Product Description Pick one of over 250 Word Cue cards (with 500 total cues), write the word you think best completes the phrase – and try to match it exactly to another player’s word without giving a single hint. Set Contains: 1 x Score Board 8 x Dry-Erase Slates 250 x Double-Sided Word Cue Cards 8 x Dry-Erase Markers 1 x Rules",https://m.media-amazon.com/images/I/61Egfbw1B4L._AC_SL1024_.jpg
B07G2VHPRW,"BLANK SLATE, The Game Where Great Minds Think Alike, Fun Family-Friendly Board Game, Word Association Party Game, Easy to Learn, Fun to Play Family Game Night, 3-8 Players, Ages 8+",15.19,4.8,5K+ bought in past month,12173,Tic Tac Toe With a Fun Twist!,https://m.media-amazon.com/images/I/91h9JLgzGAL._AC_SL1500_.jpg
B00004YO0Y,"Let's Go Fishin' Game by Pressman - The Original Fast-Action Fishing Game!, 1-4 players",8.97,4.5,8K+ bought in past month,9444,"Welcome to the unexplored island of Catan! As you and your fellow explorers gaze across the uninhabited landscape of hexagonal tracts of terrain, you quickly realize that this unique land arrangement provides ample space for each of you to put down roots. You race off to establish your respective communities by gathering resources from nearby terrain, building your infrastructure, and nurturing trade relationships. Watch out for surprises! Your rivals can block your path or send the robber to plunder your wealth",https://m.media-amazon.com/images/I/91AIua+ZBeL._AC_SL1500_.jpg
B0D94QX3BJ,"Tic Tac Toe Bolt Game,Tic Tac Toe Family Game, Classic Board Game, Classical Family Board Game,Children's Tic Tac Toe Game, Board 5 X 5 in",2.79,4.9,50+ bought in past month,13,"Beloved 1980's version of the classic mystery face game is back! There's a mystery person on your opponent's card. Can you find the matching face in the crowd? Start with your game full of silly-looking characters. Then ask the right questions to eliminate the wrong faces! Does your person have blue eyes? Is your person wearing a hat? Once you're down to a face or two - solve the mystery by guessing who! If you're the first to identify your opponent's mystery person, you win. Ages 6+",https://m.media-amazon.com/images/I/71dM6zg92zL._AC_SL1500_.jpg
B07YQ641NQ,"Stonemaier Games: Wingspan (Base Game) by Elizabeth Hargrave | A Relaxing, Award-Winning Strategy Board Game About Birds for Adults and Family | 1-5 Players, 70 Mins, Ages 14+",55.0,4.8,2K+ bought in past month,16613,"UNO Show 'em No Mercy is our most brutal UNO game yet, and with a convenient storage tin this version is easy to take on the go! It has a ton more cards with WAY tougher penalties (draw 10 cards anyone?) and new rules that will have players stacking, swapping and drawing more cards than ever before! And there's even a Mercy Rule (yes, we get the irony) if things get too rough. There are two ways to win in this merciless version of the classic game: get rid of all cards OR knock all other players out of the game! Oh and if you manage to get down to one card, don't forget to yell 'UNO!'",https://m.media-amazon.com/images/I/61+m0HYftaL._AC_SL1144_.jpg
B0CBT2N7N1,"Mattel Games UNO Show ‘em No Mercy Card Game in Storage & Travel Tin for Kids, Adults & Family Night with Extra Cards, Special Rules & Tougher Penalties (Amazon Exclusive)",16.0,4.8,10K+ bought in past month,3182,"Established in 2007, Czech Games Edtion (CGE) is dedicated to crafting innovative board games. Our passion for games drives us forward.
Founded in 2007, Czech Games Edition (CGE) released our first title, Galaxy Trucker by Vlaada Chvátil.
Since then, CGE has published over 40 games and expansions, including Codenames, Alchemists, Tzolk’in, Letter Jam, Pulsar 2849, Dungeon Petz, Space Alert, Last Will, Tash-Kalar, and many others.
is a
, with over
for the whole family,
to
alike!
At CGE (Czech Games Edition), we are the inventors, manufacturer, and publisher of all our games! After design, development, and manufacturing in the Czech Republic, we work with partners to distribute our games worldwide!
Our company headquarters is in Prague, and we have a secondary office in Brno. There, we have a full digital team that works on our apps and digital game implementations for phones, tablets, and computers!
16 agent cards in two colors, 1 double agent card, 7 innocent bystander cards, 1 assassin card, 40 key cards, 1 rulebook, 1 card stand, 1 timer, and 200 cards with 400 codenames",https://m.media-amazon.com/images/I/81v0-1r7gIL._AC_SL1500_.jpg
B00S732WJE,"Guess Who? Board Game with Classic Characters by Winning Moves Games USA, Classic Children's Mystery Board Game of Deduction for 2 Players, Ages 6+ (1191)",0.0,4.7,7K+ bought in past month,9451,"It's fun, it's challenging, it's exciting, it's SEQUENCE! Play a card from your hand, and place a chip on a corresponding space on the game board. When you have five in a row, it's a SEQUENCE. Learn to block your opponents or remove their chips, and watch out for the Jacks - they're wild! With a little strategy and luck, you'll be a winner. Includes 1 Folding Game Board (19.75"" x 15.25""), 2 Decks of SEQUENCE Playing Cards (2.25"" x 3.5""), 135 playing chips: 35 red, 50 blue and 50 green, and Complete Instructions For 2-12 players, ages 7 and up.",https://m.media-amazon.com/images/I/81g0xOuIUqL._AC_SL1500_.jpg
B014Q1XX9S,CGE Czech Games Edition Codenames Boardgame,18.19,4.8,6K+ bought in past month,31207,"You are bird enthusiasts—researchers, bird watchers, ornithologists, and collectors—seeking to discover and attract the best birds to your network of wildlife preserves. Each bird extends a chain of powerful combinations in one of your habitats. These habitats focus on several key aspects of growth.
Each bird extends a chain of powerful combinations in one of your habitats (actions) which benefit you at various points throughout the game.
Gain food tokens via custom dice in a birdfeeder dice tower. These allow you to pay the cost of the birds you wish to play.
Lay eggs using egg miniatures in a variety of colors. Eggs are points at the end of the game, but are also necessary to advance your bird sanctuary.
Points at the end of the game come from cached resources, eggs, point value on birds, tucked cards, secret objectives, and public goals.
Wingspan (Base Game)
Wingspan Asia
Wingspan European Exp.
Wingspan Speckled Eggs
Wyrmspan
Tokaido
Viticulture",https://m.media-amazon.com/images/I/71B6zU8CccL._AC_SL1500_.jpg
